{
  "id": "FB-003-ibm-plex-sans-2026-07-19",
  "kind": "fontBinary",
  "status": "pass",
  "testedOn": "2026-07-19",
  "tester": {
    "role": "automated fontTools inspection with human result review"
  },
  "subjects": {
    "fontIds": ["ibmPlexSans"],
    "fileIds": ["ff-ibm-plex-sans-gf-3-201-roman-vf"],
    "fileHashes": ["3b031aa4216174205bd8471f88a49b91f093169e9e87bd5262242bc5967fe2e3"]
  },
  "environment": {
    "operatingSystem": "macOS",
    "operatingSystemVersion": "27.0",
    "application": "fontTools",
    "applicationVersion": "4.63.0",
    "device": "arm64 Mac",
    "networkState": "online"
  },
  "input": "IBMPlexSans[wdth,wght].ttf from Google Fonts commit 8409f033cd7dee08914990602f0df5f5e70e0c14.",
  "steps": [
    "Download the exact TTF from the pinned Google Fonts source commit.",
    "Calculate SHA-256.",
    "Inspect name, version, OS/2 fsType, fvar axes, cmap, GSUB/GPOS feature tags, and required currency/punctuation code points.",
    "Compare advance widths of base digits zero through nine."
  ],
  "expected": "File parses cleanly; identity and version are readable; embedding flag, axes, binary coverage, OpenType features, currency glyphs, and numeral widths can be recorded.",
  "actual": "Parsed as IBM Plex Sans version 3.201. SHA-256 matched candidate record. fsType was 0. Weight axis was 100–700 and width axis 75–100. Basic Latin, extended Latin, Greek, and Cyrillic code points were present in this file. INR, USD, EUR, GBP, JPY, bullet, en dash, and em dash were present. Base digits had equal advance widths; a slashed-zero feature was present.",
  "artifacts": [
    {
      "pathOrUrl": "../Data/candidate-fonts.json",
      "description": "Candidate metadata derived from this inspection"
    }
  ],
  "notes": "Pass covers this Google Fonts Latin/Greek/Cyrillic file only. IBM's separately published script families are different files and require their own tests. Width-axis behaviour, application behaviour, static file choice, and human typography review remain unverified."
}
