{
  "id": "FB-006-newsreader-2026-07-19",
  "kind": "fontBinary",
  "status": "pass",
  "testedOn": "2026-07-19",
  "tester": {
    "role": "automated fontTools inspection with human result review"
  },
  "subjects": {
    "fontIds": ["newsreader"],
    "fileIds": ["ff-newsreader-gf-1-003-roman-vf"],
    "fileHashes": ["8a08d13f8a6c0d51be379a60af84f945f65369a67e509ee3c3bdcc421254d7c1"]
  },
  "environment": {
    "operatingSystem": "macOS",
    "operatingSystemVersion": "27.0",
    "application": "fontTools",
    "applicationVersion": "4.63.0",
    "device": "arm64 Mac",
    "networkState": "online"
  },
  "input": "Newsreader[opsz,wght].ttf from Google Fonts commit 991ce1de6075188e6b8977a5aa9fcd3610a4e946.",
  "steps": [
    "Download the exact TTF from the pinned Google Fonts source commit.",
    "Calculate SHA-256.",
    "Inspect name, version, OS/2 fsType, fvar axes, cmap, GSUB/GPOS feature tags, and required currency code points.",
    "Compare advance widths of base digits zero through nine."
  ],
  "expected": "File parses cleanly and exposes identity, embedding flag, axes, binary coverage, features, currency glyphs, and numeral behaviour.",
  "actual": "Parsed as Newsreader version 1.003. fsType was 0. Weight axis was 200–800 and optical-size axis 6–72. Selected Latin and Vietnamese binary checks passed; no Greek or Cyrillic claim was found in the inspected file. INR, USD, EUR, GBP, and JPY were present. Base digits had equal widths; proportional and tabular figure features were present.",
  "artifacts": [
    { "pathOrUrl": "../Data/candidate-fonts.json", "description": "Candidate metadata derived from this inspection" }
  ],
  "notes": "Pass covers binary inspection only. The continuous-reading brief remains a design intent, not proof of deck performance.",
  "followUp": "Run dense-prose, optical-size, phone, application, language, and human typography tests."
}
