{
  "id": "FB-001-source-sans-3-2026-07-19",
  "kind": "fontBinary",
  "status": "pass",
  "testedOn": "2026-07-19",
  "tester": {
    "role": "automated fontTools inspection with human result review"
  },
  "subjects": {
    "fontIds": ["sourceSans3"],
    "fileIds": ["ff-source-sans-3-gf-3-052-roman-vf"],
    "fileHashes": ["042fe2cc0b933e328410d7acbd0aa6a1873dca5aef81875f4bc214b08825c7b9"]
  },
  "environment": {
    "operatingSystem": "macOS",
    "operatingSystemVersion": "27.0",
    "application": "fontTools",
    "applicationVersion": "4.63.0",
    "device": "arm64 Mac",
    "networkState": "online"
  },
  "input": "SourceSans3[wght].ttf from Google Fonts commit 4591e3457ab8be6d70167aa6818922b91e78ab2d.",
  "steps": [
    "Download the exact TTF from the pinned Google Fonts source commit.",
    "Calculate SHA-256.",
    "Inspect name, version, OS/2 fsType, fvar axes, cmap, GSUB/GPOS feature tags, and required currency/punctuation code points.",
    "Compare advance widths of base digits zero through nine."
  ],
  "expected": "File parses cleanly; identity and version are readable; embedding flag, axes, binary coverage, OpenType features, currency glyphs, and numeral widths can be recorded.",
  "actual": "Parsed as Source Sans 3 version 3.052. SHA-256 matched candidate record. fsType was 0. Weight axis was 200–900. Basic Latin, extended Latin, Greek, and Cyrillic code points were present. INR, USD, EUR, GBP, JPY, bullet, en dash, and em dash were present. Base digits had equal advance widths; proportional figures were available as a feature.",
  "artifacts": [
    {
      "pathOrUrl": "../Data/candidate-fonts.json",
      "description": "Candidate metadata derived from this inspection"
    }
  ],
  "notes": "Pass covers binary inspection only. Exact language shaping, application behaviour, static file choice, and human typography review remain unverified."
}
